{
  "automaticPromotion": false,
  "candidateId": "shadow-case-refresh-35a06c03f9d7c77cfa6156add329c2ec",
  "candidateSha256": "a3b0f718650daea79c6e2b99565278bff3485b43396dd04d2a8acad456cec34c",
  "oracleExecution": {
    "evidence": [],
    "status": "unqualified"
  },
  "requiredImplementationPaths": [
    {
      "path": "Ability/AbilityStage/entry/src/main/ets/myabilitystage/MyAbilityStage.ets",
      "reason": "Bind the selected stage registration, callback, lifecycle and log owners."
    },
    {
      "path": "Ability/AbilityStage/entry/src/main/module.json5",
      "reason": "Bind the default stage srcEntry and EntryAbility identity to the proposed task."
    }
  ],
  "requiredOraclePaths": [
    {
      "path": "Ability/AbilityStage/entry/src/ohosTest/ets/test/Ability.test.ets",
      "reason": "Inspect the reused startup test's actual assertions and swallowed failure; test completion is not startup proof."
    },
    {
      "path": "Ability/AbilityStage/entry/src/ohosTest/ets/test/List.test.ets",
      "reason": "Bind the suite entrypoint and dispatch to the exact startup-test body."
    }
  ],
  "runtimeRequirements": [
    {
      "description": "Build, install and launch the exact source and ohosTest packages on the originally required HarmonyOS 6.0.2 API 22 emulator. API 26 availability does not satisfy this requirement; no physical-device fallback.",
      "evidence": [],
      "id": "api22-emulator-build-install",
      "status": "unqualified"
    },
    {
      "description": "Independently verify bounded language/colorMode changes, stage destruction and callback/log correlation on the same emulator and application instance.",
      "evidence": [],
      "id": "configuration-and-stage-lifecycle",
      "status": "unqualified"
    }
  ],
  "schema": "agentlab.shadow_case_construction_plan.v1",
  "wrongVariantCalibration": {
    "evidence": [],
    "executedCount": 0,
    "requiredCount": 2,
    "status": "unqualified"
  }
}
